{
  "task_id": "0009-ios-sdk-surface-extractor",
  "agent_id": "copilot-cli",
  "status": "success",
  "completed_at": "2026-05-17T04:15:00Z",
  "files_changed": [
    ".docs-ops/extractors/ios-extractor.py",
    ".docs-ops/sdk-surface/ios.json"
  ],
  "report_path": ".docs-ops/sdk-surface/ios.json",
  "validators_run": [
    {
      "name": "extractor_runs_and_produces_valid_surface",
      "passed": true,
      "stdout_tail": "OK",
      "exit_code": 0
    }
  ],
  "notes": "Extractor stats: 802 Swift files scanned across EkoChat + EkoStreamPublisher + UpstraVideoPlayerKit; 385 types, 28 protocols, 2302 members total, 63 global funcs, 112 global consts, 0 unhandled lines.\n\nSample well-formed entries:\n- AmityClient (class): primary_decl EkoChat/Core/Client/AmityClient.swift:18, 2 extensions, 42 members (sessionState, login, loginAsVisitor, logout, disconnect, etc.).\n- AmityChannel (class): primary_decl EkoChat/Features/Channel/Models/AmityChannel.swift:14, 35 members (channelId, channelType, displayName, currentUserMembership, etc.).\n- AmityMessage (class): primary_decl EkoChat/Features/Message/Models/AmityMessage.swift:13, 40 members (messageId, channelId, messageType, data, reactions, etc.).\n\nKey design decisions in the extractor:\n1. Brace-depth tracking via naive { / } counting (ignores chars inside strings — good enough for v1).\n2. Extension members aggregated under host type by name; if host type not yet seen, a frame is still pushed so members can be captured when the type is declared later in the walk.\n3. Enum cases collected via CASE_RE only when inside an `is_enum` frame.\n4. @-attribute stripping before visibility-keyword matching handles @Published, @objc, @discardableResult, @MainActor, etc.\n5. Handles `public private(set) var`, `public lazy var`, `open static func`, `public required init`, etc.\n6. typealias entries go to global_typealiases (not types) since they have no body/members.\n\nv2 upgrade path: SwiftSyntax for full param/return type capture and accurate brace tracking."
}
