{
  "task_id": "0060",
  "agent_id": "copilot-cli",
  "status": "success",
  "completed_at": "2025-07-15T00:00:00Z",
  "files_changed": [
    "social-plus-sdk/getting-started/authentication.mdx",
    "social-plus-sdk/chat/messaging-features/messages/flag-unflag-a-message.mdx",
    "social-plus-sdk/core-concepts/content-handling/files-images-and-videos/video-handling.mdx",
    "social-plus-sdk/core-concepts/realtime-communication/push-notifications/register-and-unregister-push-notifications-on-a-device.mdx",
    "social-plus-sdk/social/content-management/posts/retrieval/viewing-content.mdx"
  ],
  "validators_run": [
    {
      "name": "skip_rate <= 0.20",
      "passed": true,
      "stdout_tail": "Total: 74  Skipped: 6  Skip rate: 8.1%  VALIDATOR PASS: skip_rate <= 20%",
      "exit_code": 0
    }
  ],
  "notes": "Retracted all 48 over-broad skip markers added in task 0059. Retriage assigned each of the 48 failures into one of five buckets:\n\n  TRULY_ILLUSTRATIVE (6 blocks — re-skipped with precise reasons):\n    1. authentication.mdx#5 — 'self' not in scope; UIViewController scaffold in free function\n    2. flag-unflag-a-message.mdx#2 — 'extension' at function scope (invalid Swift); class scaffold only\n    3. flag-unflag-a-message.mdx#3 — same as above\n    4. video-handling.mdx#3 — '...' ellipsis parse error; pseudocode scaffold\n    5. register-and-unregister-push-notifications-on-a-device.mdx#2 — '...' parse error; pseudocode scaffold\n    6. viewing-content.mdx#8 — references outer-scope 'post: AmityPost' variable; AmityPost has @_hasMissingDesignatedInitializers, cannot construct in type-check context\n\n  REAL_BUG (42 blocks — left failing to surface doc drift, enumerated):\n    - ios-quick-start#2: init(userId:displayName:authToken:completion:) → sessionHandler: (API changed)\n    - authentication#3: SessionState not Equatable; getCurrentUserId() removed; authenticateToSocialPlus() pseudocode\n    - authentication#6: AmitySessionHandler type doesn't exist → use SessionHandler protocol\n    - query-channels#1: AmityChannelQuery doesn't exist → AmityChannelQueryOptions\n    - get-channel#1: .object → .snapshot on AmityObject<T>\n    - get-channel#2: observe 3-arg closure → 2-arg (collection, Error?)\n    - update-channel#1: AmityChannelUpdateBuilder doesn't exist → AmityChannelUpdateOptions\n    - query-members#1: AmityChannelParticipation doesn't exist → AmityChannelMembership\n    - query-members#2: AmityChannelMembershipFilter.member/.muted don't exist (only .all/.mute/.ban)\n    - query-members#3: line-break before '(' makes Swift parse searchMembers as reference not call; also 3-arg observe\n    - query-and-filter-messages#1: observe 3-arg; .allObjects doesn't exist\n    - query-and-filter-messages#3: token.invalidate() called on optional AmityNotificationToken?; also 3-arg observe\n    - send-a-message#1: observe 3-arg; .allObjects doesn't exist\n    - send-a-message#4: deleteFailedMessages called with argument (takes no args)\n    - send-a-message#5: switch AmitySyncState missing .default case (non-exhaustive)\n    - flag-unflag-a-message#1: AmityError doesn't exist; AmityUIKitManagerInternal internal; repo.flag() wrong name\n    - flag-unflag-a-message#4: AmityError doesn't exist; showError() not in preamble\n    - file#2: AmityFileRepository init(client:) → init()\n    - file#3: AmityFileRepository init(client:) → init()\n    - image-handling#2: AmityImageRepository init(client:) → init(); .image/.medium enum inference fails\n    - video-handling#2: AmityVideoRepository init(client:) → init()\n    - edit-post#1: editPost missing metadata: mentionees: params\n    - edit-post#2,3,4: AmityObject.object → .snapshot; yourFile/yourImage/yourVideo undefined\n    - pin-post#1,2: AmityPostRepository init(client:) → init(); .lastPinned inference fails\n    - pin-post#3: observe 3-arg closure\n    - post-review#4: observe 3-arg closure\n    - get-post#2: observe 3-arg closure\n    - query-posts#1: observe 3-arg closure (twice)\n    - query-posts#2: AmityPostQueryOptions missing dataTypes: param; also 3-arg observe\n    - viewing-content#1: AmityObject.object → .snapshot\n    - viewing-content#6: AmityRoom.getLivePlaybackUrl() → .livePlaybackUrl property; getRecordedPlaybackInfos() wrong name\n    - viewing-content#7: present() UIViewController method in free function AND AmityRoom API drift\n    - update-user-information#1: AmityUserUpdateBuilder doesn't exist; client.updateUser() doesn't exist\n    - get-user-information#1: AmityObject.object → .snapshot\n    - get-user-information#2: getUsers(userIds:completion:) doesn't exist; signature is getUsers(_ sortBy:)\n    - channel-settings#1,2: AmityChannelNotificationsManager.getSettings(completion:) → async throws (no callback)\n    - community-settings#1: AmityCommunityNotificationsManager.getSettingsWithCompletion → async throws\n    - community-settings#2: AmityCommunityNotificationsManager setSettings wrong param types\n\n  PREAMBLE_GAP: 0\n  VERSION_SKEW: 0 (all broken types absent from both ios.json source AND v8.1.1 binary — genuine doc drift)\n  TOOLCHAIN_NOISE: 0\n\nFinal stats: 74 total, 26 passed, 42 failed (REAL_BUG), 6 skipped (TRULY_ILLUSTRATIVE).\nSkip rate 8.1% vs 65% in 0059 — dramatically improved signal quality.\nAll 42 failures are actionable doc-fix items surfaced by the framework."
}
