{
  "task_id": "0063",
  "agent_id": "copilot-cli",
  "status": "success",
  "completed_at": "2026-05-19T03:10:00Z",
  "files_changed": [
    ".docs-ops/integration-tests/ios/extract-blocks.py",
    ".docs-ops/evals/ios-doc-as-test-decisions.json"
  ],
  "validators_run": [
    {
      "name": "preamble_gaps_resolved",
      "passed": true,
      "stdout_tail": "iOS failures now: 31  VALIDATOR PASS",
      "exit_code": 0
    }
  ],
  "notes": "Resolved all 3 PREAMBLE_GAP_REMAINING rows. Failures: 34 → 31.\n\nPer-row:\n  1. edit-post-block-2 (yourFile undefined)\n     Added: let yourFile = AmityUploadableFile(fileData: Data(), fileName: nil)\n     Type: AmityUploadableFile — verified public init(fileData:fileName:) in swiftinterface\n     Usage: fileRepository.uploadFile(yourFile, progress: nil) → expects AmityUploadableFile ✓\n     Result: block now passes ✓\n\n  2. edit-post-block-3 (yourImage undefined)\n     Added: let yourImage = UIImage()\n     Type: UIImage — NOT AmityUploadableFile (initially misclassified)\n     Usage: fileRepository.uploadImage(yourImage, progress: nil) → expects UIImage ✓\n     Result: block now passes ✓\n\n  3. edit-post-block-4 (yourVideo undefined)\n     Added: let yourVideo = URL(fileURLWithPath: \"\")\n     Type: URL — NOT AmityUploadableFile (initially misclassified)\n     Usage: fileRepository.uploadVideo(with: yourVideo, progress: nil) → expects URL ✓\n     Result: block now passes ✓\n\nAll 3 rows in ios-doc-as-test-decisions.json updated: decision = 'PREAMBLE_FIX (applied 0063)'\n\nFinal iOS doc-as-test stats: 74 total, 37 passed, 31 failed, 6 skipped (8.1% skip rate)\nMeeting-required rows in decision sheet: 31 (26 SIGNATURE_CHANGE + 4 REMOVED_API + 1 AMBIGUOUS)"
}
