{
  "task_id": "0002-internal-links-getting-started",
  "agent_id": "copilot-cli",
  "status": "no_change_needed",
  "completed_at": "2026-05-17T03:43:12Z",
  "files_changed": [],
  "validators_run": [
    {
      "name": "no_broken_internal_links_in_targets",
      "passed": true,
      "stdout_tail": "OK_NO_BROKEN_LINKS_IN_TARGETS",
      "exit_code": 0
    }
  ],
  "notes": "Full repo scan via tools/check_internal_links.py: 0 broken internal links across 295 files (1789 links scanned). No broken links in any of the 7 target files. No changes required."
}
