{
  "task_id": "0062",
  "agent_id": "copilot-cli",
  "status": "success",
  "completed_at": "2026-05-19T03:30:00Z",
  "files_changed": [
    ".docs-ops/evals/ios-doc-as-test-decisions.json"
  ],
  "validators_run": [
    {
      "name": "ios_decision_sheet_written",
      "passed": true,
      "stdout_tail": "OK rows=34 buckets={'SIGNATURE_CHANGE': 26, 'REMOVED_API': 4, 'PREAMBLE_GAP_REMAINING': 3, 'AMBIGUOUS': 1}",
      "exit_code": 0
    }
  ],
  "notes": "Produced decision sheet at .docs-ops/evals/ios-doc-as-test-decisions.json. 34 rows covering all failures remaining after task 0061's auto-rename batch.\n\nSummary by classification:\n  SIGNATURE_CHANGE: 26  (76% of failures)\n  REMOVED_API: 4\n  PREAMBLE_GAP_REMAINING: 3\n  AMBIGUOUS: 1\n\nKey findings for iOS SDK lead meeting:\n\n1. THE DOMINANT PATTERN IS observe 3-arg → 2-arg (14 blocks):\n   All collection observe callbacks were 3-arg { collection, change, error } in older docs; v8.1.1 has 2-arg { collection, error }. This affects: get-channel, query-members (x2), query-and-filter-messages (x2), send-a-message (x2), pin-post (x3), post-review, get-post, query-posts (x2). One batch rewrite task could fix all of these.\n\n2. SECOND LARGEST: AmityClient.login API redesign (2 blocks — ios-quick-start, authentication):\n   init(userId:displayName:authToken:completion:) → AmityClient.init() + async login(userId:displayName:authToken:sessionHandler:). The completion callback is gone; callers must implement SessionHandler protocol.\n\n3. PREAMBLE FIXES AVAILABLE (3 blocks — edit-post-block-2,3,4):\n   yourFile/yourImage/yourVideo placeholders can be stubbed using AmityUploadableFile(fileData: Data(), fileName: nil) which has a public init. These would pass after preamble fix.\n\n4. REMOVED_API items (4 blocks):\n   - AmitySessionHandler → SessionHandler (no Amity prefix)\n   - AmityUserUpdateBuilder → AmityUserUpdateOptions + client.editUser()\n   - AmityError → use AmityErrorCode (x2 flag-unflag blocks)\n\n5. AMBIGUOUS (1 block — viewing-content-block-7):\n   Both UIViewController scope issue AND AmityRoom API drift. Human decision needed: mark truly-illustrative for UIViewController context, or rewrite into a ViewController class.\n\nRecommendation for meeting agenda order:\n  1. Walk the 14 observe 2-arg rewrites first (mechanical, high-volume, one pattern)\n  2. AmityClient.login redesign (2 blocks, but user-facing auth flow — needs careful rewrite)\n  3. REMOVED_API items (4 blocks — verify replacements match intended behavior)\n  4. PREAMBLE_GAP_REMAINING (3 blocks — agent can handle autonomously after meeting approves)\n  5. AMBIGUOUS (1 block — UIViewController context decision)"
}
