{
  "task_id": "0004-troubleshooting-accordion-normalize-quickstarts",
  "agent_id": "copilot-cli",
  "status": "success",
  "completed_at": "2026-05-17T03:52:00Z",
  "files_changed": [
    "social-plus-sdk/getting-started/platform-setup/mobile/ios-quick-start.mdx",
    "social-plus-sdk/getting-started/platform-setup/mobile/android-quick-start.mdx",
    "social-plus-sdk/getting-started/platform-setup/mobile/flutter-quick-start.mdx",
    "social-plus-sdk/getting-started/platform-setup/web/web-quick-start.mdx"
  ],
  "validators_run": [
    {
      "name": "all_four_have_three_canonical_accordions",
      "passed": true,
      "stdout_tail": "OK",
      "exit_code": 0
    }
  ],
  "notes": "ios-quick-start.mdx: renamed 'Build Issues' → 'Installation Issues'; moved 'M1 Mac Simulator Issues' bullet out of Installation Issues into new 'Platform-Specific Issues' (icon: mobile). 'Swift version conflicts' and 'Framework not found' stayed in Installation Issues.\n\nandroid-quick-start.mdx: renamed 'Build Issues' → 'Installation Issues' (no bullet moves); renamed 'RxJava Issues' → 'Platform-Specific Issues', changed icon from 'code' → 'mobile'. All 3 RxJava bullets (Missing RxJava, Threading issues, Memory leaks) moved to Platform-Specific Issues.\n\nflutter-quick-start.mdx: renamed 'Platform Issues' → 'Platform-Specific Issues'; reordered accordions from [Installation, Platform, Runtime] → [Installation, Runtime, Platform-Specific]. No bullet moves.\n\nweb-quick-start.mdx: changed 'Installation Issues' icon from 'exclamation-triangle' → 'wrench'; renamed 'Browser Compatibility' → 'Platform-Specific Issues' (icon stays 'globe'); reordered from [Installation, Browser Compat, Runtime] → [Installation, Runtime, Platform-Specific]. No bullet moves."
}
