{
  "task_id": "0001-frontmatter-audit-getting-started",
  "agent_id": "copilot-cli",
  "status": "success",
  "completed_at": "2026-05-17T03:43:12Z",
  "files_changed": [
    "social-plus-sdk/getting-started/authentication.mdx",
    "social-plus-sdk/getting-started/visitor-mode.mdx"
  ],
  "validators_run": [
    {
      "name": "frontmatter_present_and_valid",
      "passed": true,
      "stdout_tail": "OK",
      "exit_code": 0
    }
  ],
  "notes": "authentication.mdx: removed trailing space from description (was 'patterns. \"' → 'patterns.\"'); length 158 chars, no other changes.\nvisitor-mode.mdx: description was multi-line (newline before closing quote) and 175 chars (>160 limit). Collapsed to single line and shortened to 149 chars: 'Enable visitor mode to allow anonymous users to browse public content without signing in. Server-side read-only controls protect platform integrity.' Key intent preserved (visitor mode, anonymous access, read-only, platform integrity). No other files had issues."
}
