{
  "task_id": "0005-flutter-install-alternative-clarification",
  "agent_id": "copilot-cli",
  "status": "success",
  "completed_at": "2026-05-17T03:55:00Z",
  "files_changed": [
    "social-plus-sdk/getting-started/platform-setup/mobile/flutter-quick-start.mdx"
  ],
  "validators_run": [
    {
      "name": "info_callout_added_after_install",
      "passed": true,
      "stdout_tail": "OK",
      "exit_code": 0
    }
  ],
  "notes": "An <Info> callout already existed immediately after the `flutter pub get` code block, referencing pub.dev for the latest version. Expanded it in place to add the 'only supported install method' statement per instructions (3 sentences). Exact callout text added:\n\n\"`pubspec.yaml` via pub.dev is the only supported installation method for the social.plus Flutter SDK. Find the latest version at [pub.dev/packages/amity_sdk](https://pub.dev/packages/amity_sdk). If you need to pin to a specific version or git ref, use Dart's standard [git-dependency syntax](https://dart.dev/tools/pub/dependencies#git-packages) in `pubspec.yaml` — no separate alternative install path is required.\"\n\nNo other content was modified."
}
