{
  "task_id": "0006-ts-rename-batch-unambiguous",
  "agent_id": "copilot-cli",
  "status": "success",
  "completed_at": "2026-05-17T04:05:00Z",
  "files_changed": [
    "social-plus-sdk/chat/moderation-safety/content-moderation/channel-moderation.mdx",
    "social-plus-sdk/video-new/getting-started/authentication.mdx",
    "use-cases/chat/channel-roles-and-permissions.mdx",
    "use-cases/chat/chat-moderation.mdx",
    "use-cases/social/livestream/live-chat-and-engagement.mdx"
  ],
  "validators_run": [
    {
      "name": "old_refs_gone_from_drift_report",
      "passed": true,
      "stdout_tail": "OK",
      "exit_code": 0
    }
  ],
  "notes": "channel-moderation.mdx (javascript block): line 64 ChannelRepository.addRoleâ†’Moderation.addRole; line 70 ChannelRepository.removeRoleâ†’Moderation.removeRole. Note: block is fenced as 'javascript', not 'typescript', but the validator scans JS blocks too.\n\nvideo-new/getting-started/authentication.mdx (typescript block): line 241 import updated to add Client alongside StreamRepository; line 270 StreamRepository.logout()â†’Client.logout(). Note: StreamRepository.authenticateUser at line 259 is NOT in the rename map and was left untouched (still flagged in drift as unknown; out of scope for this task).\n\nuse-cases/chat/channel-roles-and-permissions.mdx: 6 replacements total across 3 code blocks (2 non-indented caught by FENCE_RE, 1 indented block fixed manually). Replacements: lines 13,69,94,101 addRoleâ†’Moderation.addRole; lines 16,97,100 removeRoleâ†’Moderation.removeRole.\n\nuse-cases/chat/chat-moderation.mdx: 3 replacements â€” line 13 (non-indented block) and lines 88,91 (indented block inside <Step>) muteMembersâ†’Moderation.muteMembers.\n\nuse-cases/social/livestream/live-chat-and-engagement.mdx: line 140 import updated to add ReactionRepository; line 183 MessageRepository.addReactionâ†’ReactionRepository.addReaction; line 186 MessageRepository.removeReactionâ†’ReactionRepository.removeReaction.\n\nNo 'needs signature review' cases â€” all renames were clean call-site substitutions with identical argument patterns."
}
