{
  "task_id": "0057-wire-android-doc-as-test-into-gate",
  "agent_id": "copilot-cli",
  "status": "success",
  "completed_at": "2026-05-18T21:58:00Z",
  "files_changed": [
    ".gitignore",
    ".docs-ops/ci/check-drift.py",
    ".docs-ops/CI_GATE.md"
  ],
  "validators_run": [
    {
      "name": "gate_runs_all_four_checks_and_gitignore_clean",
      "passed": true,
      "stdout_tail": "Doc-as-test (Android):  passed=70  skipped=9  warnings=4  blocking=0  ✓\n  PASS — okay to push.\nOK",
      "exit_code": 0
    }
  ],
  "notes": "Part A (gitignore): Added 6 Android patterns covering *.kt, *.java, _manifest.json, .gradle/, build/, local.properties. Found 70 previously-tracked extracted .kt files + _manifest.json leaked from task 0056 — untracked all via `git rm -rf --cached`. Re-added .gitkeep so the directory persists in fresh clones. After re-running extract-blocks.py, `git status` shows no new untracked .kt files (all covered by new gitignore rules).\n\nPart B (check-drift.py): Added AN_DAT_DIR/EXTRACTOR/RUNNER/REPORT constants. Added run_android_doc_as_test_check() function (exact Flutter pattern: skip-if-unavailable, non-blocking crash, reads latest.json, collects failures[] as blocking). Updated print_summary() signature + body: 4th _dat_line for Android; failures loop now covers TS/Flutter/Android; runner path for Android set to 'android/run-tests.py'; verdict logic includes an_blocking. Updated main(): calls run_android_doc_as_test_check(); overall_fail includes an_blocking; --quiet line extended with an_passed/an_skipped/an_blocking; --json-out includes doc_as_test_android key.\n\nPart C (CI_GATE.md): Updated intro sentence to 'Three languages'. Added Android/Kotlin gate policy paragraph. Scope section: replaced 'Future — iOS and Android' with Android entry (29 pages) + 'iOS is the remaining platform'. Added Android running-locally block.\n\nGate run output:\n  Regex drift:           baseline=0  candidate=0  delta=0  ✓ No new drift\n  Doc-as-test (TS):       passed=72  skipped=4  warnings=0  blocking=0  ✓\n  Doc-as-test (Flutter):  passed=41  skipped=3  warnings=0  blocking=0  ✓\n  Doc-as-test (Android):  passed=70  skipped=9  warnings=4  blocking=0  ✓\n  PASS — okay to push.\n\nQuiet one-liner: docs-ops drift: baseline=0 candidate=0 delta=0 new_pairs=0 ts_passed=72 ts_skipped=4 ts_blocking=0 fl_passed=41 fl_skipped=3 fl_blocking=0 an_passed=70 an_skipped=9 an_blocking=0 verdict=PASS\n\nNote: The 4 Android warnings are Kotlin deprecation/unchecked-cast notices from the SDK itself — non-blocking by design."
}
